{
  "title": "OpenDXL API Schema",
  "id": "https://opendxl.github.io/opendxl-api-specification/v0.1/schema.json#",
  "$schema": "http://json-schema.org/draft-04/schema#",
  "required": [
    "openDxlApi",
    "info"
  ],
  "definitions": {
    "stringArray": {
      "description": "Similar to the stringArray definition in JSON Schema Draft 4 but allows for the array to be empty",
      "type": "array",
      "items": {
        "type": "string"
      },
      "uniqueItems": true,
      "default": []
    },
    "otherField": {
      "type": "object",
      "description": "An individual 'other field' in a DXL message. See 'otherFields' in the 'message' property.",
      "properties": {
        "description": {
          "$ref": "http://json-schema.org/draft-04/schema#/properties/description"
        },
        "example": {
          "description": "Example value for this 'other field'",
          "type": "string"
        },
        "required": {
          "type": "boolean",
          "description": "Determines whether or not this other field is required or optional.",
          "default": false
        }
      },
      "additionalProperties": false
    },
    "message": {
      "type": "object",
      "description": "Common properties for all messages which can be sent on a DXL fabric",
      "properties": {
        "payload": {
          "$ref": "http://swagger.io/v2/schema.json#/definitions/schema"
        },
        "otherFields": {
          "type": "object",
          "description": "The 'other fields' which can appear in a DXL message. 'other fields' add 'header'-like name/value pairs without requiring modifications to be made to the payload.",
          "properties": {
            "additionalProperties": {
              "$ref": "#/definitions/otherField"
            }
          }
        },
        "description": {
          "$ref": "http://json-schema.org/draft-04/schema#/properties/description"
        },
        "externalDocs": {
          "$ref": "http://swagger.io/v2/schema.json#/definitions/externalDocs"
        }
      }
    },
    "response": {
      "description": "A 'response' message which can be sent in response to a 'request' message sent on a DXL fabric",
      "type": "object",
      "allOf": [
        {
          "$ref": "#/definitions/message"
        }
      ]
    },
    "request": {
      "description": "A 'request' message which can be sent on a DXL fabric",
      "type": "object",
      "allOf": [
        {
          "$ref": "#/definitions/message"
        },
        {
          "type": "object",
          "properties": {
            "response": {
              "$ref": "#/definitions/response"
            },
            "alternateResponses": {
              "description": "Map of string identifiers/names to corresponding alternative responses to this request. This is used in cases where a request that matches the provided schema is capable of producing responses with different payload structures depending on the request content or the service's processing.",
              "type": "object",
              "patternProperties": {
                "*": {
                  "$ref": "#/definitions/response"
                }
              },
              "additionalProperties": false
            },
            "errorResponses": {
              "description": "Map of integer-based error codes to corresponding 'response' objects. The map describes the possible DXL error response messages which can be returned for a failed request.",
              "type": "object",
              "patternProperties": {
                "^-?[0-9]+$": {
                  "$ref": "#/definitions/response"
                }
              },
              "additionalProperties": false
            }
          }
        }
      ]
    },
    "requests": {
      "description": "A map of DXL request topic names to corresponding 'request' objects",
      "type": "object",
      "additionalProperties": {
        "$ref": "#/definitions/request"
      }
    },
    "event": {
      "description": "An event message which can be sent on a DXL fabric",
      "type": "object",
      "allOf": [
        {
          "$ref": "#/definitions/message"
        },
        {
          "type": "object",
          "properties": {
            "isIncoming": {
              "type": "boolean",
              "description": "Whether this event is received (incoming) or sent by the solution.",
              "default": false
            }
          }
        }
      ]
    },
    "events": {
      "description": "A map of DXL event topic names to corresponding 'event' objects",
      "type": "object",
      "additionalProperties": {
        "$ref": "#/definitions/event"
      }
    },
    "serviceMetadataItem": {
      "type": "object",
      "description": "An individual 'item' in a DXL service 'metadata' object. See 'metadata' in the 'service' property.",
      "properties": {
        "description": {
          "$ref": "http://json-schema.org/draft-04/schema#/properties/description"
        },
        "example": {
          "description": "Example value for this metadata item",
          "type": "string"
        }
      },
      "additionalProperties": false
    },
    "service": {
      "description": "Information for a service registered with a DXL fabric",
      "type": "object",
      "properties": {
        "info": {
          "$ref": "http://swagger.io/v2/schema.json#/definitions/info"
        },
        "externalDocs": {
          "$ref": "http://swagger.io/v2/schema.json#/definitions/externalDocs"
        },
        "requests": {
          "description": "A map of DXL request topic names to corresponding request definitions under '#/requests' in this document",
          "type": "array",
          "items" : {
            "type": "object",
            "allOf": [
              {
                "$ref": "http://swagger.io/v2/schema.json#/definitions/jsonReference"
              },
              {
                "properties": {
                  "$ref": {
                    "pattern": "^#/requests/[^/]+"
                  }
                }
              }
            ]
          }
        },
        "metadata": {
          "description": "Metadata which can be registered with the DXL service. The metadata is typically used to include information such as the versions for products that are exposing DXL services, etc.",
          "type": "object",
          "properties": {
            "additionalProperties": {
              "$ref": "#/definitions/serviceMetadataItem"
            }
          }
        }
      },
      "additionalProperties": false
    },
    "services": {
      "description": "A map of DXL 'service type' strings to corresponding 'service' objects",
      "type": "object",
      "additionalProperties": {
        "$ref": "#/definitions/service"
      }
    },
    "solution": {
      "description": "Information for an individual DXL solution",
      "type": "object",
      "properties": {
        "info": {
          "$ref": "http://swagger.io/v2/schema.json#/definitions/info"
        },
        "externalDocs": {
          "$ref": "http://swagger.io/v2/schema.json#/definitions/externalDocs"
        },
        "events": {
          "description": "A map of DXL event topic names to corresponding event definitions under '#/events' in this document",
          "type": "array",
          "items" : {
            "type": "object",
            "allOf": [
              {
                "$ref": "http://swagger.io/v2/schema.json#/definitions/jsonReference"
              },
              {
                "properties": {
                  "$ref": {
                    "pattern": "^#/events/[^/]+"
                  }
                }
              }
            ]
          }
        },
        "services": {
          "description": "A map of DXL 'service type' strings to corresponding service definitions under '#/services' in this document",
          "type": "array",
          "items" : {
            "type": "object",
            "allOf": [
              {
                "$ref": "http://swagger.io/v2/schema.json#/definitions/jsonReference"
              },
              {
                "properties": {
                  "$ref": {
                    "pattern": "^#/services/[^/]+"
                  }
                }
              }
            ]
          }
        }
      },
      "additionalProperties": false
    }
  },
  "properties": {
    "openDxlApi": {
      "description": "The OpenDXL API version of this document",
      "type": "string",
      "enum": [
        "0.1"
      ]
    },
    "info": {
      "$ref": "http://swagger.io/v2/schema.json#/definitions/info"
    },
    "externalDocs": {
      "$ref": "http://swagger.io/v2/schema.json#/definitions/externalDocs"
    },
    "definitions": {
      "$ref": "http://swagger.io/v2/schema.json#/definitions/definitions"
    },
    "events": {
      "$ref": "#/definitions/events"
    },
    "requests": {
      "$ref": "#/definitions/requests"
    },
    "services": {
      "$ref": "#/definitions/services"
    },
    "solutions": {
      "description": "A map of DXL solution names to corresponding 'solution' objects",
      "type": "object",
      "additionalProperties": {
        "$ref": "#/definitions/solution"
      }
    }
  },
  "additionalProperties": false
}
